{
  "agent": {
    "model": "configured-default-unrecorded",
    "name": "Codex CLI isolated",
    "provider": "OpenAI",
    "version": "0.140.0"
  },
  "context": {
    "contextWindowTokens": null,
    "dynamicContextChars": 205,
    "lazyLoadedFiles": [
      "AGENTS.md",
      "current-state.md",
      "feature_list.json"
    ],
    "loadedHarnessChars": 7617,
    "startupFiles": [
      "AGENTS.md"
    ],
    "staticPrefixChars": 5684
  },
  "evidenceRefs": [
    "docs/harness/evidence/token-economics/codex-isolated-profile-moderate-r1-2026-06-16.json",
    "docs/harness/evidence/evidence-log.md"
  ],
  "harnessProfile": {
    "changedSurfaces": [
      "AGENTS.md",
      "feature_list.json",
      "current-state.md",
      "docs/harness/README.md",
      "docs/harness/authoritative-facts.md",
      "docs/harness/state/roadmap.md",
      "docs/harness/state/first-agent-task.md",
      "docs/harness/boundaries/component-inventory.md",
      "docs/harness/feedback/verification-matrix.md",
      "docs/harness/feedback/sensor-registry.md"
    ],
    "description": "Generated root routers plus current state, feature state, and selected startup harness docs.",
    "name": "moderate"
  },
  "limitations": [
    "Tiny read-only orientation task; not a held-out implementation benchmark.",
    "Profile roots are ignored scratch fixtures, not long-lived target repositories.",
    "Codex JSONL did not emit the configured model name in this run.",
    "Prompt/cache state from nearby runs may affect cached input buckets.",
    "No project verification command was run because the task explicitly prohibited tests.",
    "Raw JSONL contains local working-directory output and remains ignored under .harnessforge/."
  ],
  "mechanism": {
    "expectedExecutionEffect": "improve",
    "expectedTokenEffect": "mixed",
    "name": "instruction_routing",
    "notes": "Runner used scratch HOME and CODEX_HOME, ignore-user-config, ignore-rules, and disabled hooks/plugins/memories/apps/multi_agent.",
    "risk": "Moderate startup guidance can load generated state placeholders before code context."
  },
  "outcome": {
    "completed": true,
    "failureMode": null,
    "qualityScore": 1.0,
    "verificationVerdict": "not_run",
    "worstCaseQuality": 1.0
  },
  "promotionStatus": "inconclusive",
  "recordedAt": "2026-06-16T21:08:00Z",
  "schemaVersion": "harnessforge.tokenEconomicsMetric.v1",
  "target": {
    "commit": "scratch-isolated-profile-comparison-2026-06-16-moderate-r1",
    "platform": "macOS-26.5.1-arm64-arm-64bit-Mach-O",
    "repoLabel": "token-economics-demo"
  },
  "task": {
    "category": "read-only-orientation",
    "description": "Read the repo instructions and the fewest files needed. Do not edit files. Do not run project tests. Answer with exactly two bullets: first, the project verification command; second, the current next step.",
    "heldOut": false,
    "id": "token-economics.profile-orientation.moderate.r1"
  },
  "tokens": {
    "cacheReadInput": 15104,
    "cacheWriteInput": null,
    "output": 408,
    "reasoningOutput": 48,
    "source": "agent_usage_report",
    "startupInput": 28449,
    "total": 28905,
    "uncachedRepeatedInput": null
  },
  "trajectory": {
    "durationSeconds": null,
    "editCalls": 0,
    "fileReads": 3,
    "retries": 0,
    "searchCalls": 0,
    "toolCalls": 4,
    "turns": 1,
    "verificationRuns": 0
  }
}
